username,tweets,date,likes,retweets
Piu_Europa,".@riccardomagi ha depositato una pdl per riconoscere finalmente anche in Italia il matrimonio egualitario e il riconoscimento dei figli delle coppie omogenitoriali alla nascita.
Questa è la soluzione necessaria sostenuta affinché l’Italia si metta al passo con gli altri paesi.",2022-12-28 13:53:18+00:00,19,4
Piu_Europa,"La decisione d’impedire la definizione ‘genitore’ sui documenti d’identità di figli di coppie omogenitoriali, nonostante un parere contrario del garante della privacy e di un tribunale, mistifica la realtà ed è inutilmente crudele nei confronti dei bambini.
@yurigu https://t.co/86JbrtbAVI",2022-12-28 13:53:18+00:00,77,19
Piu_Europa,È importante che queste ragazze non vengano lasciate sole e per questo continueremo a batterci e a sostenere in ogni sede e in ogni piazza il coraggio delle donne iraniane e il loro grido di libertà.,2022-12-28 11:09:09+00:00,35,3
Piu_Europa,"Sara Khadim al-Sharia ha avuto il coraggio di mettere tutto in gioco per lanciare un allarme: non abbiamo paura delle repressioni perché il grido di libertà è più forte.
E così Sara ha sfidato il regime iraniano giocando ai Mondiali di scacchi senza l'hijab. https://t.co/lLp5dChjF7",2022-12-28 11:09:08+00:00,167,33
Piu_Europa,Iscriviti entro il 31 dicembre per partecipare al congresso di febbraio: https://t.co/rUTR1umZMT,2022-12-25 12:18:27+00:00,2,1
Piu_Europa,"Ora che al Governo c’è chi vuole un’Italia con meno tecnologia, meno investimenti sui giovani e meno diritti, noi ti auguriamo un’Italia col segno + e continueremo a lottare per questo.
+Ricerca, +Lavoro, +Innovazione, +Libertà. 
Perché meriti tutto, meriti di+. 
Buone Feste! https://t.co/ngv7tNniLZ",2022-12-25 12:18:27+00:00,65,7
Piu_Europa,L’intervento integrale del presidente di #PiuEuropa @riccardomagi alla #Camera sulla #Manovra https://t.co/QH7YcrXB0E,2022-12-23 19:02:17+00:00,3,2
Piu_Europa,"🔴 #Manovra, @riccardomagi “#PiuEuropa vota no: una fiducia in queste condizioni è uno schiaffo al Parlamento. Ed è una legge di bilancio con tante mance e marchette ai partiti ma è senza strategia di lungo termine: guarda al passato e non ai veri esclusi, che sono i giovani”. https://t.co/qc4zLARUzn",2022-12-23 19:00:56+00:00,56,12
Piu_Europa,"Sottomesse, chiuse in casa, coperte dal burqa, cancellate dalla società: per i Talebani le donne afghane devono semplicemente sparire. E nella escalation di decisioni disumane e misogine dell’ultimo anno, sono arrivati a vietare loro anche l’istruzione universitaria.
@iladonatio https://t.co/bSAh6mjIhT",2022-12-21 16:32:37+00:00,36,13
Piu_Europa,"Lo Spid, il Pos, le ricette elettroniche sono entrate nelle abitudini degli italiani perché semplificano e migliorano la vita delle persone.
Perché tornare indietro?
Questa guerra al progresso e alla tecnologia racconta bene l’ideologia retrograda e reazionaria di questo governo. https://t.co/WrkRPRnl88",2022-12-21 11:18:44+00:00,323,52
Piu_Europa,"Siamo il partito che cambia le cose un diritto alla volta, anche questa volta. Grazie a tutti quelli che ci hanno sostenuto oggi e che continueranno farlo. 
Iscriviti a #PiuEuropa: https://t.co/rUTR1u4QyL",2022-12-19 10:07:45+00:00,8,0
Piu_Europa,"Retromarcia governo sul #Pos è vittoria del buon senso, della libertà di scelta dei consumatori, della concorrenza leale. E anche, nel nostro piccolo, delle migliaia di cittadini che hanno sottoscritto la nostra petizione “liberi di scegliere come pagare”. @giordanomasini 1/2 https://t.co/DHSQgDyBg8",2022-12-19 10:07:45+00:00,74,12
Piu_Europa,"Il Governo Meloni ha fatto una poco onorevole quanto inevitabile retromarcia anche sul Pos. 

Da una parte attacchi alla Bce e rifiuto di ratificare il nuovo MES; dall’altra, la bocciatura di misure ideologiche e inutili: puro autolesionismo anti Ue a danno dell’Italia. https://t.co/4lEgnTIBWZ",2022-12-18 11:58:29+00:00,216,34
Piu_Europa,"Silvio Berlusconi ha un problema con le donne: ostenta il proprio amore per loro ma in realtà le disprezza da sempre.
Ci piacerebbe credere che quando i soliti faranno il suo nome come possibile successore di Mattarella, ci sarà una rivolta di popolo. Almeno del 51,3% di noi. https://t.co/6qaA1O6jsV",2022-12-14 15:22:59+00:00,169,27
Piu_Europa,"I pesanti rilievi critici mossi dalla Commissione Europea alla legge di bilancio, in particolare su pos, contanti, condoni e prepensionamenti, sono nell’interesse dell’Italia e degli italiani, e come tali vanno recepiti immediatamente.
Meno male che c’è l’Europa.
@giordanomasini https://t.co/VQZjhqVAXQ",2022-12-14 13:32:45+00:00,61,14
Piu_Europa,"Sono passati quattro anni da quel terribile attentato a Strasburgo, a poche centinaia di metri dalla sede del Parlamento europeo.
Quegli spari hanno spento la voce ma non il ricordo e il sogno di Antonio Megalizzi.
Il sogno di un’Europa dei diritti e delle libertà.
Ciao Antonio. https://t.co/Fj0zdFw870",2022-12-14 10:33:05+00:00,74,14
Piu_Europa,"Si può non essere entusiasti dei troppi bonus che si sono accumulati negli anni ma è assurdo che la maggioranza proponga come prima cosa l’abolizione di #18App, uno strumento funziona, che responsabilizza i 18enni e incentiva attività importanti alla formazione. 
@bendellavedova https://t.co/XQtfUAwjXH",2022-12-10 10:13:50+00:00,139,24
Piu_Europa,@MatteoFragnan Ciao. Hai assolutamente ragione. Era nel nostro programma elettorale 😊,2022-12-10 09:57:59+00:00,8,0
Piu_Europa,Firma la nostra petizione: https://t.co/pFXDfj5lKg,2022-12-09 13:23:35+00:00,20,2
Piu_Europa,"In Francia, dal 1 gennaio 2023 i giovani tra i 18 e 25 anni potranno procurarsi gratuitamente preservativi nelle farmacie.
Una proposta che anche noi avevamo portato avanti e per la quale continueremo a batterci.
Rendiamo anche noi i preservativi gratuiti per gli under 25. https://t.co/ai06p4CEDp",2022-12-09 13:23:35+00:00,199,36
Piu_Europa,"La Commissione europea muove i primi passi per armonizzare a livello UE i diritti dei figli e delle famiglie, comprese quelle formate da genitori LGBTI+.
Bene! Anche il nostro Paese è pronto per una riforma volta a riconoscere le famiglie arcobaleno e i loro figli.
@cmqpiena https://t.co/S4ZMGJb83K",2022-12-07 14:06:15+00:00,124,20
Piu_Europa,"Ecco perché abbiamo lanciato una petizione, che in pochi giorni ha raccolto migliaia di sottoscrizioni, per dire no a questa misura illiberale. E’ una questione di civiltà, libertà e legalità. 
✍️Se sei un rompiballe anche tu, firma qui: https://t.co/ohtSQCQwKe 3/3 https://t.co/Ks2SbJQhXv",2022-12-05 15:59:26+00:00,85,20
Piu_Europa,"Quello che il governo Meloni e il vicepremier Salvini stanno dicendo per giustificare lo stop all’obbligo dei pagamenti con i sistemi elettronici sotto i 60 euro non ha alcuna attinenza con la realtà. Lo dicono i dati, lo dice la Banca d’Italia e la Corte dei Conti. 2/3 https://t.co/ykhZ9tolPd",2022-12-05 15:59:20+00:00,99,25
Piu_Europa,"“Abbiamo i costi più alti d’Europa!”
“Pagare con Carta di Credito non conviene!”
“Chi paga il caffè con il Pos è un rompiballe!”.
Ne abbiamo sentite di tutti i colori. 
E allora smontiamo un po’ di #fakenews sul #Pos 1/3 https://t.co/V0cnqXgvaE",2022-12-05 15:59:11+00:00,259,59
Piu_Europa,"Da Matteo Salvini un’offesa alla libertà delle persone che devono avere il diritto di pagare come vogliono, in contanti o con carta di credito, qualsiasi somma, anche per un aperitivo o un caffè. 
Se sei un rompiballe come noi, firma qui: https://t.co/ohtSQCynw6 https://t.co/S23GU60T0k",2022-12-03 14:44:21+00:00,274,49
Piu_Europa,"Martedì 6 dicembre
Ore 9.00 via Quattro Novembre 149, Roma
@emmabonino, insieme a No Peace Without Justice - Non c'è Pace Senza Giustizia e Le Contemporanee, con il supporto di +Europa, organizzano l’evento “La Forza delle Donne"". 
Registrati all'evento: https://t.co/7xWQsb1HvV https://t.co/rWyif2EVFl",2022-12-03 13:16:37+00:00,34,13
Piu_Europa,"#OpzioneDonna del governo prevede che si possa andare in pensione a un’età variabile a seconda del numero dei figli: a 58 anni con due figli, a 59 con uno e a 60 con zero. Un #handmaidstale all'italiana, discriminatoria e incostituzionale
Leggi @iladonatio https://t.co/huOfLj9NoI https://t.co/S5CeaTBFVS",2022-12-01 16:11:55+00:00,47,30
Piu_Europa,"Tantissimi passi avanti sono stati fatti da quando è stato scoperto, ma la piaga dell'#AIDS non è ancora stata debellata.
Fondamentale fare prevenzione, soprattutto tra le nuove generazioni, che non conoscono il virus e non hanno ricevuto una educazione sessuale a scuola. https://t.co/RH8plHsLgt",2022-12-01 09:44:43+00:00,81,15
Piu_Europa,"Migliaia di firme in pochi giorni per la nostra petizione che chiede al Governo di fermare la proposta che vuole togliere il diritto di usare carte e bancomat per pagamenti al di sotto dei 60 euro.
Aiutaci a dare forza a questa petizione.

Firma anche tu: https://t.co/ohtSQCynw6 https://t.co/AhWmTzqIW0",2022-11-30 16:33:08+00:00,133,33
Piu_Europa,"NASCE IN CONSIGLIO REGIONALE DELLA CAMPANIA IL GRUPPO CONSILIARE DI +EUROPA
Presentato oggi da @bendellavedova, Luigi Cirillo e Salvatore Aversano, nel corso di una conferenza stampa, il Gruppo +Europa nel Consiglio regionale della Campania. https://t.co/RdVL83FSM9",2022-11-29 13:29:14+00:00,35,8
Piu_Europa,"LIBERI DI SCEGLIERE COME PAGARE!
Firma ora la petizione e fermiamo la proposta del Governo che vuole toglierci il diritto di usare carte e bancomat per pagamenti al di sotto di 60 euro.
https://t.co/ohtSQCQwKe https://t.co/QFL4ep3J9P",2022-11-28 16:20:38+00:00,607,110
Piu_Europa,"Quella di Ischia è una tragedia che toglie il fiato, e per la quale esprimiamo profondo cordoglio ai familiari delle vittime, agli sfollati e a tutta la città.
L’abusivismo aumenta i rischi e va combattuto, non condonato.
@bendellavedova https://t.co/sKlB95xU1t",2022-11-28 11:40:07+00:00,56,16
Piu_Europa,"Abbiamo visto la sfilata di politici di maggioranza e di opposizione che sottoscrivono l’appello contro il cosiddetto “#cibosintetico” di #Coldiretti e ci chiediamo perché questa ostilità contro il progresso e l’innovazione. 
L'articolo di @giordanomasini https://t.co/fJ56EBvFgl",2022-11-26 14:11:24+00:00,104,20
Piu_Europa,"Finora in Italia ci sono stati 273 omicidi: 104 di questi hanno come vittime le donne. Non è cronaca nera: è una questione di diritti umani.
Ben venga l’istituzione di una Commissione bicamerale ma non dimentichiamo che è innanzitutto una questione culturale e di educazione. https://t.co/pjYWGoXWDc",2022-11-25 10:29:18+00:00,60,11
Piu_Europa,"Il governo dispone la fine dell’obbligo per pagamenti al di sotto dei trenta euro con il Pos.
Una misura che non porta alcun vantaggio per gli esercenti se non la maggiore facilità di fare transazioni in nero, un regalo ai soliti noti e uno schiaffo a tutti noi.
@giordanomasini https://t.co/CJOzJKz3Jl",2022-11-24 15:09:13+00:00,139,30
Piu_Europa,"Le tue battaglie sono le nostre battaglie.
Per portarle avanti abbiamo bisogno di te.
Inserisci il codice R45 in dichiarazione dei redditi per destinare il 2xmille a +Europa.
Hai tempo fino al 30 novembre: a te non costa nulla, per noi vale tantissimo. https://t.co/WTQoOP59TS",2022-11-24 11:29:29+00:00,19,8
Piu_Europa,"“Durante la seconda guerra mondiale non avrei avuto il diritto di vivere. Per il fatto di essere omosessuale, liberale ed ebreo sarei stato condannato tre volte a morte. Oggi sono libero di essere qui. E' questo il progetto europeo"".
Xavier Bettel, premier Lussemburgo https://t.co/gGbLqYAaQ2",2022-11-23 14:55:34+00:00,135,30
Piu_Europa,"🎂TANTI AUGURI A NOI 🎂

🇪🇺 #PiùEuropa oggi compie 5 anni.
Cinque anni sempre dalla stessa parte, quella delle nuove generazioni, dei diritti e delle libertà.

Cinque anni in prima linea per un’Italia più europea, più libera, più democratica e più giusta. https://t.co/70NdO7MIcp",2022-11-23 12:04:52+00:00,70,11
Piu_Europa,"#Malan cita Bibbia stigmatizzando omosessualità come abominio e conferma cultura oscurantista e contro libertà individuale di questa destra. Troppi indizi di questi giorni fanno prova: destra reazionaria e illiberale.
#PiuEuropa per matrimonio egualitario e adozioni coppie lgbt. https://t.co/2xGkOXXfY1",2022-11-22 17:45:42+00:00,149,36
Piu_Europa,https://t.co/HYo6AqiBLh,2022-11-22 13:48:18+00:00,31,4
Piu_Europa,"Secondo il M5S il taglio dei parlamentari avrebbe ridotto i costi della politica di 100 milioni l’anno, mezzo miliardo a legislatura, un miliardo in dieci anni.
Tutte promesse false.
Leggi il nostro approfondimento per saperne di più. https://t.co/0W89DAc85u",2022-11-22 13:48:16+00:00,70,25
Piu_Europa,"Un silenzio che vale mille parole.
La nazionale iraniana non ha cantato l’inno nazionale e si è poi stretta in cerchio in segno di protesta nei confronti del regime degli ayatollah.
L'Iran avrà anche perso la partita contro l’Inghilterra, ma ne ha vinta una molto più importante. https://t.co/560tdP6kvk",2022-11-21 17:29:01+00:00,190,41
Piu_Europa,"Qualcosa si è mosso alla Cop27 ma non si è certo voluto prendere atto che la crisi climatica chiede agli Stati, alle istituzioni e ai cittadini del mondo molto più impegno.
Questa è l’emergenza sulle emergenze: la crisi climatica.
Leggi l'analisi:
https://t.co/Rak7SwP1VZ",2022-11-21 10:07:35+00:00,16,4
Piu_Europa,"La Lega propone la detrazione delle spese sostenute per i matrimoni in Chiesa. Il beneficio andrebbe riservato a italiane e italiani da almeno dieci anni e che scelgono il matrimonio religioso, ovviamente rigorosamente etero: una perla di reazionario analfabetismo costituzionale https://t.co/aV7sCfN4XE",2022-11-20 17:58:16+00:00,198,46
Piu_Europa,"Il Transgender Day of Remembrance è dedicato alla memoria delle vittime di transfobia. La politica deve rimuovere le discriminazioni insite nelle leggi e promuovere una cultura del rispetto. Da Milano a Roma, da Cuneo a Cagliari, aderiamo alle manifestazioni per il #TDoR2022 🏳️‍⚧️ https://t.co/T82N8MHPJi",2022-11-20 13:03:27+00:00,35,11
Piu_Europa,"Le piattaforme del commercio online devono pagare le tasse dove producono gli utili, non devono assumere posizioni di monopolio, rispettare le regole e le leggi sul lavoro lungo tutta la filiera, ma sono un pezzo della economia contemporanea e non un nemico da colpire. https://t.co/MU0yKUa95e",2022-11-19 16:05:59+00:00,35,10
Piu_Europa,"Le consegne a domicilio sono ormai un servizio irrinunciabile, avvantaggiano chi vive in aree interne e persone con scarsa mobilità. Penalizzare furgoni e furgoncini “non ecologici” favorirebbe traffico auto versl negozi e centri commerciali, aumentando  i livelli di inquinamento https://t.co/d5ZwAvHdwE",2022-11-19 16:05:57+00:00,30,10
Piu_Europa,"Per favorire il commercio “di prossimità”, nella manovra il governo vuole introdurre la cosiddetta “Amazon tax”, cioè una tassa sulle consegne per gli acquisti e-commerce effettuate con mezzi non ecologici.
È un’idea sbagliata. https://t.co/47lexGzkVQ",2022-11-19 16:05:55+00:00,67,18
Piu_Europa,"Ci sono voluti 27 anni per arrivare ieri in consiglio comunale alla cancellazione delle mozioni omofobe.
Azioni come queste fanno girare pagina nei confronti della politica intollerante e discriminatoria delle destre veronesi. 
Anna Lisa Nalin https://t.co/dGCCxNQJtB",2022-11-18 14:38:49+00:00,120,24
Piu_Europa,Grazie e benvenuto ❤️ 🇪🇺 https://t.co/pszwKWSviO,2022-11-17 16:57:47+00:00,22,3
Piu_Europa,"Oggi è la giornata internazionale degli studenti
Gli altri partiti vedono studenti e giovani come bancomat da cui prelevare soldi con cui pagare il debito pubblico; per noi di +Europa, invece, il diritto allo studio, la valorizzazione degli studenti e i loro diritti sono centrali https://t.co/eFU3CFEKTP",2022-11-17 16:01:33+00:00,83,21
Piu_Europa,"Cade un'altra bufala salviniana, quella sul genitore 1 - 2.
La giustizia italiana riconosce la realtà dei fatti e sconfessa la propaganda omofoba della destra.
Risultato giudiziario ci ricorda la necessità di una riforma del diritto di famiglia che non discrimini più.
@cmqpiena https://t.co/U0yi00QyhM",2022-11-16 17:49:02+00:00,219,40
Piu_Europa,L’intervento integrale di @riccardomagi https://t.co/yDIkmxNQOw,2022-11-16 14:09:08+00:00,8,3
Piu_Europa,"#Piantedosi parla di dignità umana come priorità dell’azione del Governo. Noi nelle ultime due settimane abbiamo visto un altro film: un brutto film fatto di accanimento su un numero esiguo di naufraghi basato sulla mistificazione dei dati sull’accoglienza.
@riccardomagi https://t.co/qDzcMznipL",2022-11-16 14:05:54+00:00,83,19
Piu_Europa,https://t.co/Ue3Abcq3pt,2022-11-15 16:17:22+00:00,17,4
Piu_Europa,"Domenica inizieranno i mondiali in Qatar.
La decisione di assegnare i mondiali al Qatar è più che controversa a causa della sistematica violazione dei diritti civili e sociali che avvengono nel Paese.
Una partita persa in partenza.
Scopri tutto quello che non va nei mondiali. https://t.co/yJz3Xvumxw",2022-11-15 16:17:19+00:00,49,9
Piu_Europa,"Lavrov, ministro degli Esteri russo, in un videomessaggio ha voluto rassicurare il mondo: sta bene. E continuerà a combattere contro ""l'Occidente che sta distruggendo la Russia"". Con iPhone, Apple Watch e maglietta di Basquiat. 
Tutta l’ipocrisia del regime di Putin in una foto. https://t.co/dp5Z2QRZyu",2022-11-14 17:23:10+00:00,554,88
Piu_Europa,https://t.co/vDjYkeLprK,2022-11-14 15:31:56+00:00,31,9
Piu_Europa,https://t.co/SmW2GPyHwi,2022-11-14 15:31:55+00:00,28,9
Piu_Europa,"“L’Italia è il Paese che accoglie più migranti”. “L’Italia è la porta d’ingresso in Europa per i migranti”. “Le Ong favoriscono il numero di sbarchi”.
Quante volte hai sentito ripetere queste frasi?
Nessuna di queste è vera.
Leggi tutti i numeri, reali, sulla questione migranti. https://t.co/95XfAWnok2",2022-11-14 15:31:53+00:00,121,36
Piu_Europa,"Al via a Roma l’assemblea di +Europa.

📲 Puoi seguire i lavori sul nostro canale YouTube: https://t.co/yL0kLDPjUM https://t.co/FD07EVGvZS",2022-11-12 10:10:49+00:00,42,10
Piu_Europa,"Non sono più tollerabili episodi di discriminazione come quello avvenuto a Roma, soprattutto in luoghi, come appunto le scuole, dove l’inclusione dovrebbe essere la priorità. L’Italia deve adeguare la propria normativa, ma soprattutto la propria cultura.",2022-11-10 14:21:53+00:00,18,1
Piu_Europa,"L’episodio di transfobia avvenuto contro uno studente di un liceo romano fa riflettere sulla necessità di introdurre per legge nelle scuole, università e luoghi di lavoro la possibilità di riconoscere la carriera alias come avevamo previsto nel programma elettorale. 
@cmqpiena https://t.co/K4p6gbvp81",2022-11-10 14:21:52+00:00,64,12
Piu_Europa,"Dopo giorni di sofferenza, tutti i migranti a bordo delle navi Ong Humanity 1 e Geo Barents sono sbarcati.
Nonostante l’ostilità del governo pronto a calpestare la costituzione, le leggi italiani e internazionali.
Oggi Meloni Salvini e Piantedosi hanno perso. E ha vinto l’umanità https://t.co/zlZLWXUVQi",2022-11-09 13:33:01+00:00,120,22
Piu_Europa,"A violare la legge non sono i migranti, ma il governo italiano.
I migranti per la legge italiana devono essere portati nei centri di crisi per essere identificati e per l’assistenza. Non si può modificare la legge con un decreto.
Piantedosi riferisca in Aula.
@riccardomagi https://t.co/7j8XeiOliR",2022-11-07 16:38:12+00:00,154,43
Piu_Europa,"Leggi i comunicati stampa di @bendellavedova e @riccardomagi 
https://t.co/6cfr6W6l3S",2022-11-06 17:48:18+00:00,15,2
Piu_Europa,#Humanity1: L'azione sconsiderata del ministro #Piantedosi ha prodotto una situazione illegale e paradossale.I migranti salvati in mare dalle navi ONG non sono ostaggi dello Stato italiano: facciamoli scendere tutti https://t.co/EMP1BSSDWB,2022-11-06 17:48:17+00:00,186,38
Piu_Europa,Guarda l'intervento integrale: https://t.co/VJOOyMfNsK,2022-11-06 11:09:30+00:00,12,0
Piu_Europa,"#SlavaUkraini
La Russia di Putin oggi è un'immensa prigione dove si muore di menzogna e di violenza. Gli ucraini stanno difendendo il confine della democrazia, delle libertà, dei diritti civili e della dignità. Cos'altro dovevamo mandargli se non armi? 
Simona Viola a #Milano https://t.co/8TBLotgHjo",2022-11-06 11:08:19+00:00,166,37
Piu_Europa,"Quando @SimoPillon ti attacca, vuol dire che sei sulla strada giusta.
Un saluto decostruttivo 😘 https://t.co/OVjgOKnDzo",2022-11-04 17:14:44+00:00,369,40
Piu_Europa,"Domani saremo alla manifestazione di #Milano per esprimere la nostra solidarietà al Popolo Ucraino vittima dell'aggressione di Putin. @Costanzopaolo 
https://t.co/LJhmKKwaMA",2022-11-04 13:39:57+00:00,97,20
Piu_Europa,"#raveparty
@emmabonino: “Il governo ha espresso per decreto la linea securitaria che intende seguire. Secondo me non solo non risolve ma aggrava il problema, nella discrezionalità che lascia ai prefetti e nella vaghezza del reato dei 50: e se sono 52, che succede? https://t.co/OqrI5paa8q",2022-11-03 18:29:06+00:00,109,21
Piu_Europa,Per approfondire le nostre proposte: https://t.co/qWPkVaG3ei,2022-11-03 15:17:02+00:00,24,8
Piu_Europa,"Abbiamo presentato oggi il nostro ""pacchetto diritti"": si tratta di sette proposte per avanzare su diritti civili e libertà personali.
Sono la nostra sfida alla maggioranza ma anche all’opposizione: dei diritti non basta parlare, bisogna agire https://t.co/L0umc3KTeJ",2022-11-03 15:17:02+00:00,278,35
Piu_Europa,"💥 SETTE PROPOSTE PER I DIRITTI 💥
Segui in diretta la conferenza stampa di presentazione delle iniziative parlamentari di #PiuEuropa 
🔴📲 https://t.co/ayhbNcoYf4

Con @emmabonino @riccardomagi @bendellavedova https://t.co/eUp9UX8NwL",2022-11-03 09:17:44+00:00,33,13
Piu_Europa,"7 PROPOSTE DI LEGGE PER NON TORNARE INDIETRO
Domani alle ore 10, presso Sala Stampa Camera dei deputati, si terrà la conferenza per la presentazione di un pacchetto di proposte di legge di +Europa in materia di diritti.
Segui la diretta!
@emmabonino @riccardomagi @bendellavedova https://t.co/Ad6elGI5k6",2022-11-02 16:59:42+00:00,91,17
Piu_Europa,"PS. Come abbiamo sempre fatto, renderemo pubblici i nostri finanziamenti nei tempi e nei modi previsti dalla legge.",2022-11-02 11:06:50+00:00,137,10
Piu_Europa,"E rivendichiamo il sostegno di #Soros alle nostre battaglie, comuni con lui, per diritti umani e civili, per l'antiproibizionismo, per lo Stato di diritto. E lo ringraziamo per quello che fa.
Leggi l'intervista di @bendellavedova https://t.co/nhYgAoqycf",2022-11-02 11:06:50+00:00,127,19
Piu_Europa,"In questi giorni sulla stampa si parla del finanziamento di #Soros ad alcuni nostri candidati. 
Non solo confermiamo tutto, ma lo rivendichiamo: con Soros abbiamo una consolidata e duratura condivisione dei valori politici liberali e democratici e una comune visione europeista https://t.co/CF4wuNhEsw",2022-11-02 11:06:48+00:00,951,220
Piu_Europa,… per la quale venga ipotizzato (dal Governo) un pericolo per l’ordine pubblico. Capito bene? 5/5 https://t.co/1ficnNIDHc,2022-11-01 14:58:32+00:00,108,21
Piu_Europa,"Quindi dalla pubblicazione in Gazzetta Ufficiale del decreto, a poter essere incriminati per questa nuova fattispecie di reato penale e a rischiare quindi la reclusione da tre a sei anni saranno le persone che organizzano e partecipano a qualsiasi manifestazione… 4/5 https://t.co/g2IhEWxPBS",2022-11-01 14:58:31+00:00,78,18
Piu_Europa,"E l’espressione “può derivare un pericolo per l’ordine pubblico …” è sufficientemente vaga per ricadere nell’arbitrio più assoluto. 
Di chi? Essenzialmente dei prefetti, ovvero del Governo. 3/5 https://t.co/oBuc3AoZU5",2022-11-01 14:58:28+00:00,75,14
Piu_Europa,"Nella definizione di “terreni o edifici altrui, pubblici o privati” ricade di tutto: i capannoni o i campi in cui vengono organizzati i rave, ma anche le università, i luoghi di lavoro, le piazze. 2/5 https://t.co/4eSWkviBfU",2022-11-01 14:58:26+00:00,71,13
Piu_Europa,"Il decreto del governo sui #raveparty, una volta letto il testo, ha tutta l’aria di essere una cosa ben più seria e più grave di quanto sembrasse ieri 1/5 https://t.co/fTFBcEZ3S5",2022-11-01 14:58:25+00:00,285,68
Piu_Europa,"Primo Consiglio dei Ministri: manette per chi va ai rave e premio ai medici #novax.

#Meloni non smette di fare propaganda e manda un messaggio autoritario e uno populista e antiscientifico. 
Dalla propaganda di lotta alla propaganda di Governo.

@bendellavedova https://t.co/WCARJ36Ji8",2022-10-31 17:52:01+00:00,199,45
Piu_Europa,"Un anno fa depositavamo in cassazione 630.000 firme raccolte in pochi giorni per il #referendumcannabis.
Uno spazio di democrazia aperto grazie all’iniziativa parlamentare di @riccardomagi che ha permesso di arrivare a un passo da una grande conquista di civiltà.
@giordanomasini https://t.co/Df1wqBmlkZ",2022-10-28 14:03:56+00:00,40,7
Piu_Europa,"Il fascismo è una invenzione italiana, poi “esportata” nel mondo, di cui possiamo e dobbiamo solo vergognarci.
Mussolini e il suo regime non torneranno, ma le autocrazie autoritarie sono un pericolo reale ed attuale, fuori e dentro i confini dell’Unione europea. 
#MarciasuRoma https://t.co/8sdyseewoY",2022-10-28 08:43:44+00:00,389,69
Piu_Europa,"L'inasprimento della legge contro la cosiddetta ""propaganda omosessuale"" è la prova che a pagare il prezzo del regime dittatoriale di Putin, oltre agli ucraini, sono anche i cittadini russi.
Il nuovo governo italiano sarà capace di esprimere una ferma condanna?
@yurigu https://t.co/ojE3zm3DzN",2022-10-27 14:25:47+00:00,102,27
Piu_Europa,"Mentre Giorgia Meloni pronunciava parole di simpatia per i suoi contestatori, gli studenti della #Sapienza venivano manganellati dalle Forze dell'Ordine.
Insieme a @riccardomagi e @bendellavedova presenteranno un'interrogazione parlamentare per chiedere chiarezza al Governo. https://t.co/eqkbZhIh8K",2022-10-25 17:34:03+00:00,168,38
