username,tweets,date,likes,retweets
bendellavedova,"Oggi Giorgia Meloni è tornata a difendere Orban, definendolo “democratico” rispetto al documento di condanna del parlamento europeo.",2022-09-16 08:17:24+00:00,62,11
bendellavedova,"La mia intervista a La Cabina elettorale di Adam con @aledenicola e @alexbarbera per la @AdamSmithIT 
📲 https://t.co/S3ElGzHOu9 https://t.co/qzxiriKWs6",2022-09-16 07:04:23+00:00,15,4
bendellavedova,“Cedo due Mattarella per mezzo Putin” diceva Salvini qualche anno fa. Noi di @Piu_Europa siamo in campo per contrastare nelle urne questa destra nell’unico modo possibile: in una coalizione di centro sinistra capace di competere sui seggi del maggioritario. Questa sera a #genova https://t.co/xtj1k0UZ2m,2022-09-15 19:31:08+00:00,16,2
bendellavedova,"Parlamento Ue approva condanna Ungheria, definita ‘minaccia sistemica’ a valori Ue. Orban minaccia democrazia #diritticivili. Lega e FdI, Salvini e Meloni votano contro. Orban è da sempre loro amico e modello. Chi si piglia s'assomiglia. 
Ecco perchè bisogna votare @Piu_Europa",2022-09-15 14:02:19+00:00,64,20
bendellavedova,"E questo viene anche prima di eventuali finanziamenti occulti da Mosca, che sarebbero gravissimi e su cui fa fatta chiarezza prima del voto.",2022-09-15 09:40:34+00:00,8,1
bendellavedova,"Obiettivo Putin è destabilizzare Ue e Italia economicamente e politicamente. Fallirà come ha fallito in Ucraina. Serve chiarezza, specialmente a destra dove Salvini e Berlusconi hanno sempre considerato Putin interlocutore positivo e nemmeno ora lo considerano vero nemico.",2022-09-15 09:40:33+00:00,14,4
bendellavedova,"Milano è europeista, riformatrice e dei diritti. Una città libera in cui si rispettano le regole. Siamo in campo per questo: per battere Salvini e Meloni e la loro visione d’Italia, sconfitta qui solo un anno fa dal Sindaco @BeppeSala.
#MilanoRestaLibera
@Piu_Europa @PdMilano https://t.co/l8J8jCC8tk",2022-09-14 20:58:25+00:00,10,5
bendellavedova,"Putin ha scatenato una guerra contro l’Ucraina e l’Europa, con armi e gas: è essenziale che gli elettori sappiano se dietro le note simpatie politiche per il dittatore russo, in particolare a destra, ci siano anche sostegni finanziari diretti a partiti o personalità politiche.",2022-09-14 06:24:52+00:00,63,12
bendellavedova,È importante che i nomi dei partiti e dei politici che abbiano ricevuto finanziamenti da Putin vengano resi pubblici prima e non dopo le elezioni del 25 settembre.,2022-09-14 06:24:52+00:00,361,64
bendellavedova,"Quanto successo in Polonia e Ungheria si sta verificando qui nelle Marche con l’aborto, che è stato messo in discussione. È uno schema: un pezzo alla volta la destra vuole mettere in discussione i diritti. Non ci riusciranno
Ieri sera a Pesaro a sostenere @giordanomasini https://t.co/ioUud3L4VS",2022-09-13 08:40:39+00:00,23,5
bendellavedova,"Con governo di Salvini e Meloni l’Italia cambierebbe rotta. Per anni sono cresciuti nel consenso propagandando un’idea di Italia ben precisa: anti Ue , reazionaria sui diritti, nazionalista nell’economia. Con la destra al governo “è finita la pacchia”, come direbbe Meloni. https://t.co/bdqTCt996O",2022-09-12 16:19:19+00:00,22,7
bendellavedova,"Conte ha fatto cadere Draghi, uno dei più rigorosi sostenitori di #Kiev. 
E ora che Putin, dopo le sanzioni e gli aiuti militari, sta entrando in difficoltà, chiede all’Italia di sospendere il sostegno militare all’Ucraina. 
Il programma di Conte è l’agenda Putin.",2022-09-11 12:33:26+00:00,274,56
bendellavedova,"Kiev ha prima resistito all’aggressione di Putin, ora comincia a liberare il territorio occupato. Il sostegno occidentale ed europeo, a partire dalle sanzioni, è stato e resterà decisivo. La resistenza Ucraina è la nostra resistenza, a difesa dei valori e degli interessi europei.",2022-09-11 06:59:08+00:00,283,40
bendellavedova,"Tra ieri e oggi Campania, Basilicata, Puglia e Sicilia. 
Abbiamo parlato di PNRR, soldi garantiti dall’Ue per investire sul futuro del Paese e del sud.
#Salvini e #Meloni vogliono trasformare il #PNRR in mance elettorali: lo impediremo.
@Piu_Europa #ElezioniPolitiche22 https://t.co/fEqMovzZiL",2022-09-10 20:29:10+00:00,31,4
bendellavedova,"Calenda continua a raccontare balla di Bonino candidata contro di lui. Bonino è semplicemente nel “suo” collegio, dove vive e fu eletta nel 2018. Sapeva si sarebbe ricandidata lì: ha scelto di candidarsi contro di lei, favorendo così esponente Fdi. Poteva candidarsi alla Camera. https://t.co/7dnz2N5VXb",2022-09-10 08:15:27+00:00,56,7
bendellavedova,"Carlo, io casomai ripeto con convinzione slogan che erano di Calenda pochi giorni fa. Tu hai cambiato idea su Salvini/Meloni (come su Renzi: bastava nominarlo per farti imbestialire). Io ci credevo e non ho cambiato idea. Fattene una ragione; magari ricambierai idea https://t.co/3QuQMHgeEf https://t.co/pFHpH2lF8C",2022-09-10 08:15:06+00:00,26,1
bendellavedova,Tantissima gente a #Palermo alla presentazione dei candidati di @Piu_Europa alle #ElezioniPolitiche2022 l e alle elezioni regionali siciliane con @CaterinaChinnic. https://t.co/x27N7hqPak,2022-09-09 20:29:10+00:00,17,8
bendellavedova,"Al collegio senatoriale di Roma, a sfidare @emmabonino sarà una esponente di #Fdi antiabortista e pro-life. Questo collegio è l’emblema dello scontro di visione tra noi e i sovranisti: chi sta in mezzo e chiede voti dei progressisti fa il gioco dei reazionari di Meloni e Salvini https://t.co/gWu4VbRors",2022-09-09 14:11:57+00:00,15,3
bendellavedova,"Carlo, il fatto è che non hai i voti per vincere nessun collegio uninominale ma i voti a te farebbero vincere Meloni in tantissimi collegi. Si chiama maggioritario e non è fatto, come hai detto tu, per #comoditerzismi https://t.co/aQKDTMm6E5",2022-09-09 06:41:06+00:00,195,43
bendellavedova,"Chi vuole alternativa a Meloni, continuità con Draghi, passi avanti su diritti, concentrerà il voto e sceglierà l'alleanza di centrosinistra votando @Piu_Europa. Per mantenersi nel solco europeo da protagonisti e non da antagonisti
Intervista a @repubblica
https://t.co/gWtUxb5KBH",2022-09-08 08:03:32+00:00,41,9
bendellavedova,"Ora in diretta con @ilfoglio_it. Parliamo di #ElezioniPolitiche2022 e di @Piu_Europa 
Qui per seguire: https://t.co/UgqFOpmpkK https://t.co/dcL6SGXwol",2022-09-07 15:21:16+00:00,13,7
bendellavedova,Ci vediamo questa sera #tg2post @tg2rai @Piu_Europa 🇪🇺 https://t.co/LqkpQDKr8A,2022-09-06 16:05:12+00:00,26,6
bendellavedova,"Se si vuole un governo diverso, ‘draghiano’, bisogna battere la Meloni e la destra. E per batterla, bisogna contrastarla nei collegi uninominali, dove i competitori sono due, destra e centrosinistra",2022-09-06 13:41:29+00:00,36,5
bendellavedova,"Ieri Carlo Calenda, oggi Mara Carfagna: trovo sconcertante che gli esponenti del #TerzoPolo, a 20 giorni dal voto, chiedano insistentemente alla #Meloni di fare un governo con una maggioranza ampia. Se la destra vince o stravince fa il governo di destra, punto. https://t.co/jv9llWoG6B",2022-09-06 13:41:28+00:00,54,9
bendellavedova,"Siamo in campo con @Piu_Europa per battere #salvini e #meloni, non per farci un governo insieme. 
#ItaliaRestaLibera https://t.co/D5ONU3oEcG",2022-09-06 10:40:25+00:00,40,9
bendellavedova,"Per me la situazione non è cambiata: l’obiettivo è battere Salvini e Meloni e magari continuare ad avere Draghi a Palazzo Chigi. Siamo in campo perché non vogliamo più vedere un’Italia governata da sovranisti, populisti e da nazionalisti economici.
Altro che governo con la Meloni",2022-09-05 12:37:14+00:00,33,6
bendellavedova,"Abbiamo fatto un patto con Letta, che ha tenuto più di tutti la schiena dritta sul sostegno all’Ucraina contro Putin, che partiva da un presupposto: le prossime elezioni saranno una scelta di campo tra un’Italia che resta tra i grandi paesi Ue e un’Italia alleata di Orban e Putin",2022-09-05 12:37:14+00:00,33,4
bendellavedova,"L’Italia sul serio o Fratelli d’Italia, sul serio? 

Carlo Calenda oggi ha detto che è pronto a fare un governo con Giorgia Meloni. 
Noi pensiamo che Giorgia Meloni vada battuta, non che ci si debba fare un governo con lei.",2022-09-05 12:37:14+00:00,288,36
bendellavedova,"C'è un solo voto liberale che è possibile esprimere il 25 settembre. E' quello a @Piu_Europa 
E’ l’unica scelta possibile per impedire la vittoria della destra ed evitare che arrivi ai 2/3 per cambiare la costituzione. 
Noi non ci arrendiamo all'Italia di Meloni. https://t.co/hfIT43dYu5",2022-09-04 15:56:34+00:00,73,12
bendellavedova,"#ITALIARESTALIBERA 🇪🇺

Oggi a Roma si apre la campagna elettorale di @Piu_Europa .

Saranno 20 giorni entusiasmanti per un’Italia più libera ed europea e per non consegnare l’Italia a questa destra orbaniana, anti Ue e filo Putin. 
A tra poco! 
#IoVotoPiuEuropa https://t.co/C6LMk0vwuF",2022-09-04 07:04:32+00:00,68,15
bendellavedova,"Il voto a @Piu_Europa è l'unico voto europeista e liberal-democratico che non aiuta la destra di Salvini e Meloni. 
A loro diciamo che le priorità del Pnrr non si toccano: dobbiamo far fare un salto di qualità al SudItalia, non finanziare la spesa corrente come vorrebbe loro https://t.co/9e4uulsYou",2022-09-02 15:54:25+00:00,44,8
bendellavedova,"Il PNRR serve per fare un salto di qualità, a partire dal sud.
Meloni e Salvini stravolgerebbero priorità del Piano: userebbero risorse straordinarie per fare cose ordinarie, spesa pubblica corrente.
Noi siamo in campo per impedire che questo avvenga.
Oggi a #salerno @Piu_Europa https://t.co/vUyI2eALqO",2022-09-02 13:29:52+00:00,25,5
bendellavedova,"Meloni gioca a fare la moderata, ma basta vedere il suo comizio con Vox in Spagna per capire qual è la prospettiva sua e dell’Italia, se sarà la destra a vincere. 🇮🇹 deve restare libera, anche per questo nostra scelta di coalizione riformatrice e europeista.
#PadovaRestaLibera https://t.co/LLwtErkJCB",2022-09-01 17:29:50+00:00,30,6
bendellavedova,"Vogliamo che l’Italia sia protagonista in Europa o che si rinchiuda nella propria sovranità di cartone, come vogliono i partiti irresponsabili che hanno fatto cadere il governo Draghi?
Abbiamo bisogno di +Europa su energia, economia, export.
#VicenzaRestaLibera
#ItaliaRestaLibera https://t.co/TpYWid2NYx",2022-09-01 17:29:48+00:00,12,1
bendellavedova,"Oggi a Verona per la #campagnaelettorale.
Sui diritti non si può stare fermi: o si va avanti o si va indietro.
@Piu_Europa difende i diritti di libertà economica e di libertà civile e lavora per conquistarne di nuovi.
I diritti, seriamente.
#VeronaRestaLibera
#ItaliaRestaLibera https://t.co/nJWx6lUScc",2022-09-01 12:53:29+00:00,35,6
bendellavedova,"Carlo, non cambiare le carte in tavola. Come sai, Emma è candidata nel “suo” collegio, dove fu eletta nel 2018. 
Mentre ancora insieme negoziavamo col PD, del resto, era pacifico che Emma rimaneva al Senato a Roma centro. Emma non si fa usare. @EnricoLetta https://t.co/TbWUH0j10G",2022-09-01 06:39:56+00:00,301,46
bendellavedova,"Oggi in Veneto per presentare i candidati di @Piu_Europa .
Ci vediamo tra poco a #Verona, #Vicenza e #Padova! https://t.co/ZtquXpcLOb",2022-09-01 05:37:21+00:00,20,5
bendellavedova,Bene la decisione del Governo Draghi su #ItaAirWays: la vendita deve proseguire nell’interesse della compagnia stessa che ha bisogno di investimenti per competere e crescere. E nell’interesse dei contribuenti che hanno ripianato perdite miliardarie per anni e anni.,2022-08-31 10:34:37+00:00,77,14
bendellavedova,"Con #Gorbaciov se ne va un visionario e un riformatore che credeva nella forza delle idee e degli individui. 

Con coraggio ha messo fine alle divisioni tra Est e Ovest, divisioni che Putin sta brutalmente ricreando. 

La sua eredità politica rimane un esempio per tutti. https://t.co/Nfen0zqbq9",2022-08-31 06:31:02+00:00,61,9
bendellavedova,"Scusa, parlo di Meloni e tu polemizzi con me? 
Sono semplicemente in modalità “le prossime elezioni sono una scelta di campo tra un'Italia tra i grandi Paesi europei e un'Italia alleata con Orban e Putin” (cit.); e l’aritmetica non è un’opinione. https://t.co/xxNLkprRCP",2022-08-30 13:04:54+00:00,27,4
bendellavedova,"Caro @matteorichetti, pensavo che avessimo un obiettivo comune: battere Meloni e i sovranisti reazionari. Non farò la lezioncina sui vostri candidati no-tap o filo Putin o anti Draghi. Del resto, voto è per 3/5 maggioritario e voi aiutate Meloni-Salvini. https://t.co/6Xol2u7i4h",2022-08-30 12:08:00+00:00,28,3
bendellavedova,"Salvini propone di dare mandato a Draghi su caro energia. Sarebbe stato meglio per italiani se Salvini non lo avesse… mandato a casa, insieme a Conte e Berlusconi. 
Da giorni diciamo che spetta a Draghi, pur dimissionario, prendere iniziativa e avrà pieno sostegno di @Piu_Europa",2022-08-28 10:45:12+00:00,72,12
bendellavedova,"Sul piano Ue @Piu_Europa sostiene l’iniziativa Draghi su tetto europeo a prezzo gas. Sul piano interno, sostenere famiglie e imprese contro caro bollette, accelerare diversificazione, ridurre consumi, spingere su rinnovabili e sui rigassificatori. Come quello da fare a Piombino.",2022-08-28 10:11:04+00:00,15,4
bendellavedova,"Il sindaco FdI di #Piombino è contrario al rigassificatore. @GiorgiaMeloni cosa pensa sia “meglio per la Nazione”, come direbbe lei, portare il rigassificatore a Piombino oppure no? https://t.co/JaPJeSUgU5",2022-08-28 10:11:03+00:00,47,9
bendellavedova,"La Russia, attraverso la sua Ambasciata a Roma, torna ad attaccare direttamente il quotidiano @repubblica. So benissimo che il direttore @Maumol e la redazione hanno le spalle solide, ma questa messa all’indice della stampa libera da parte del regime putiniano è inaccettabile.",2022-08-26 18:00:25+00:00,297,39
bendellavedova,"Bella chiacchierata con @mattiabdu, Presidente del Municipio 1 di Milano, sui principali temi della città dove sono candidato nell’uninominale Camera. https://t.co/j2Q6XDyrky",2022-08-26 11:29:40+00:00,10,0
bendellavedova,"Spia russa infiltrata nel quartier generale Nato a Napoli evidenzia una volta di più quanto sia fondamentale per futuro Italia fare chiarezza su Putin. 
La destra, con Salvini e Berlusconi, resta come minimo ambigua, anche su sostegno a Ucraina e sanzioni. 
+Europa -Putin https://t.co/mEBuPWVVSC",2022-08-26 07:43:35+00:00,69,19
bendellavedova,"Quando sento Meloni che vuole rivedere #PNRR mi spavento perché prima cosa che farà è usare risorse straordinarie Ue per fare cose ordinarie, ovvero debito da coprire con i soldi europei.
Ecco perché, giorno dopo elezioni, @Piu_Europa indicherà #Draghi per guidare nuovo governo https://t.co/VAdm9p2nix",2022-08-25 18:10:28+00:00,62,26
bendellavedova,"Ora al #Tg2Post per parlare di #UNAGENERAZIONEAVANTIil programma elettorale di @Piu_Europa 
#ElezioniPolitiche2022 https://t.co/rQvKHMEKGY",2022-08-23 18:58:44+00:00,35,7
bendellavedova,Qui trovate il programma completo https://t.co/kM6USboWvx #ElezioniPolitiche22  #ElezioniPolitiche2022 #elezioni,2022-08-23 14:40:28+00:00,15,3
bendellavedova,"Una Generazione Avanti è il programma di @Piu_Europa dei prossimi 5 anni, per i prossimi 30 anni. https://t.co/S7Q8gi96yF",2022-08-23 14:40:27+00:00,23,5
bendellavedova,"Oggi con @emmabonino e @CottarelliCPI abbiamo presentato il programma di @Piu_Europa. 
Si chiama UNA GENERAZIONE AVANTI: scuola, formazione, ricerca, fisco vantaggioso per i giovani e il suo pianeta, diritti e Stati Uniti d’Europa. Questo è il programma di +Europa. https://t.co/ZwoOfcNzPH",2022-08-23 14:40:09+00:00,187,33
bendellavedova,"Le liste di @Piu_Europa sono fatte da persone che hanno costruito in questi anni il nostro partito e ha passione:
militanti e dirigenti. Nessun personaggio. 
Il nostro programma?
- federalismo europeo
- innovazione, ricerca e scuola
- fisco per i giovani 
- diritti civili https://t.co/Kolc5ycZLV",2022-08-23 07:36:10+00:00,58,15
bendellavedova,"Destra promette ritorno a quota 100, aumento a mille euro pensioni minime senza sostenibilità finanziaria, blocco vendita #Ita e rinegoziazione PNRR. 
Ogni voto a @Piu_Europa servirà per contrastare Salvini e Meloni. 
Tutto il resto aiuterà l’arroccamento economico dei sovranisti https://t.co/XqDyl6O8W3",2022-08-19 12:02:49+00:00,91,22
bendellavedova,"#Medvedev ripropone il ricatto putiniano: gas in cambio di un Governo amico che ribalti le politiche di Draghi di sostegno all’Ucraina. Una ragione in più per battere la destra di Salvini e Berlusconi, co-affossatori di Draghi e da sempre indulgenti con l’autocrate del Cremlino",2022-08-18 16:48:56+00:00,251,50
bendellavedova,"Bene che Agcom abbia chiesto a #DAZN chiarimenti e indennizzi dopo debacle ieri. Resta da capire come Lega Calcio intenda intervenire per far sì che oltre a pagare tifosi possano vedere decentemente partite. Così si crea disaffezione e si mortifica settore, anche economicamente",2022-08-15 10:39:09+00:00,29,4
bendellavedova,"La #LegaCalcio e #DAZN stanno sequestrando il
Campionato di calcio ai tifosi paganti, a causa dei malfunzionamenti. Il campionato comincia nel
peggiore dei modi. 
A questo punto si rende necessario l’intervento dell’Agcom. https://t.co/j7sW6NErmn",2022-08-14 19:04:05+00:00,223,31
bendellavedova,"Il 25 settembre si vota su Europa, diritti, nuove generazioni. Integrazione europea per noi, modello orbaniano per Salvini e Meloni. Matrimonio egualitario, eutanasia e cannabis legale per noi, leggi Pillon per loro. Risorse per giovani e concorrenza per noi,corporazioni per loro https://t.co/5KIef2qirV",2022-08-13 14:05:15+00:00,69,11
bendellavedova,"#PieroAngela ha avuto, tra gli altri, un merito straordinario: ha insegnato a milioni di italiani a fidarsi della scienza e ad essa affidarsi quando necessario.
Un uomo straordinario per passione e talento. La terra gli sia lieve. https://t.co/BbmGTLBnJg",2022-08-13 11:10:21+00:00,145,14
bendellavedova,Dopo 30 anni di minacce #SalmanRushdie è stato barbaramente aggredito mentre esercitava un diritto fondamentale: la libertà di pensiero e di espressione. L’unico modo per sconfiggere il terrorismo - ha detto - è di non averne paura. La sua voce non deve e non sarà messa a tacere. https://t.co/8oUJyIfVK6,2022-08-13 09:27:35+00:00,132,18
bendellavedova,"Questo è il simbolo con cui @Piu_Europa si presenterà alle elezioni.
Siamo pronti a rappresentare il voto europeista, liberaldemocratico e riformatore. 
E che non vogliono regalare l’Italia alla destra “orbaniana”, intrisa di nazionalismo, xenofobia e omofobia.

#IoVotoPiuEuropa https://t.co/DqhO3WGw6P",2022-08-12 18:28:59+00:00,117,10
bendellavedova,"Le parole di #Berlusconi su  #Mattarella sono gravi ed inquietanti, perché dimostrano la mancanza di senso dello Stato e rispetto delle istituzioni. 
Per contrastare nelle urne la deriva orbaniana dell’Italia, il voto più utile è a @Piu_Europa",2022-08-12 08:38:09+00:00,209,15
bendellavedova,"Le pensioni a mille euro è una balla pazzesca totalmente insostenibile: capisco paghi elettoralmente ma si distruggono le prospettive dei giovani. Preferisco fare il contrario: detassare reddito giovani, mettere più soldi su borse di studio e pagare Università  a chi non può https://t.co/lAyaYUQAUg",2022-08-11 08:50:22+00:00,158,28
bendellavedova,"Sono felicissimo della scelta di Carlo #Cottarelli. 
Credo che la sua candidatura con @Piu_Europa e @pdnetwork sia un esempio di quello che noi abbiamo messo nel patto sottoscritto: serietà, visione europea, visione del ruolo dell'Italia in Ue https://t.co/jYTZ4UyEen",2022-08-10 12:47:15+00:00,153,10
bendellavedova,"💥 Ci vediamo tra poco in conferenza stampa. Big news! 
@Piu_Europa @pdnetwork @emmabonino @EnricoLetta @riccardomagi @Ferrandelli @giordanomasini https://t.co/eveESEa4MY",2022-08-10 10:34:41+00:00,140,7
bendellavedova,"Due anni dalle elezioni fraudolente in #Bielorussia con cui il regime di Lukashenko ha reso il Paese protettorato di Putin. 
Italia ed Europa sono al fianco del popolo bielorusso e delle sue legittime aspirazioni democratiche #StandWithBelarus @Tsihanouskaya",2022-08-09 11:40:05+00:00,87,12
bendellavedova,"Fare politica seria, per me significa che quando prendi una decisione e sottoscrivi pubblicamente un impegno, lo rispetti. A maggior ragione quando gli altri lo rispettano.
La mia intervista al @Corriere https://t.co/NLKy4v22Gz",2022-08-08 07:59:23+00:00,369,63
bendellavedova,📺 Ora in diretta su @agorarai https://t.co/tFXQdbxzZs,2022-08-05 06:14:47+00:00,15,3
bendellavedova,"La determinazione di Draghi a risolvere in tempi brevi, secondo quanto già previsto, la cessione di #ItaAirways è nell’interesse dei contribuenti e dell’azienda. La retorica dell’italianità ha solo bruciato risorse pubbliche e impedirebbe lo sviluppo dell’azienda.",2022-08-04 20:11:52+00:00,452,50
bendellavedova,"#Quota100 è stata uno spreco di soldi, una follia economica e un’ingiustizia verso i giovani. 
Chi vota @Piu_Europa e @Azione_it vota per proseguire l’#agendaDraghi, che serve per le prossime generazioni, non per le prossime elezioni. https://t.co/Io9hedamAF",2022-08-04 11:54:46+00:00,429,60
bendellavedova,"Con il voto di oggi, Italia diventa 22mo Paese a ratificare il Protocollo di adesione alla #NATO di Svezia e Finlandia, anticipando di poche ore gli USA. Abbiamo convintamente fatto la nostra parte per Alleanza difensiva più ampia e più forte e con maggiori capacità di deterrenza",2022-08-03 17:25:17+00:00,816,65
bendellavedova,"Il nostro impegno non mancherà perché si arrivi ad una legge di libertà, responsabilità e civiltà sul suicidio assistito. Forza #MarcoCappato!",2022-08-03 11:07:06+00:00,68,9
bendellavedova,"Sostengo la battaglia di @marcocappato sul #finevita; e ammiro la sua azione nonviolenta di autodenuncia, ripetuta anche oggi. Lo scandalo dei suoi processi è al contempo un’accusa e un richiamo potente al Parlamento, al legislatore, drammaticamente e colpevolmente latitante.",2022-08-03 11:07:05+00:00,237,27
bendellavedova,"Raggiungere l’accordo è stato impegnativo, ci abbiamo lavorato molto perché volevamo fare un patto elettorale nella chiarezza tra forze distinte. La campagna elettorale comincia ora: non solo si apre ma si riapre la competizione. 
Mia intervista al @Tg1Rai 
@Piu_Europa @Azione_it https://t.co/O3476uwOyp",2022-08-02 18:35:01+00:00,71,6
bendellavedova,"Il patto elettorale che abbiamo siglato oggi tra @Piu_Europa/@Azione_it e il @pdnetwork era la cosa giusta da fare; ed è stata fatta bene.

Ora avanti con la campagna elettorale, con la forza della federazione Azione/+Europa, di @emmabonino e @CarloCalenda. https://t.co/PYamgMUayz",2022-08-02 17:31:34+00:00,163,19
bendellavedova,Vedremo se una risposta ci sarà e quale sarà. Restiamo in attesa 2/2,2022-08-01 15:25:26+00:00,133,11
bendellavedova,"Appello segreteria PD non è risposta a temi politici che @Piu_Europa e @Azione_it hanno posto ieri a @EnricoLetta. Poco credibile, peraltro, riferimento ad alleanza nel solco di Draghi mentre si mantiene come prioritario l’accordo con forze sempre all’opposizione di Draghi. 1/2",2022-08-01 15:25:25+00:00,452,49
bendellavedova,"Tutta la solidarietà mia e di @Piu_Europa a la redazione de @LaStampa per l’inaccettabile intimidazione, cui sono certo i giornalisti reagiranno con il lavoro e la qualità che li caratterizza.

https://t.co/fmwgUnCtS8",2022-08-01 13:27:05+00:00,60,9
bendellavedova,"Ma anche partire da alcuni elementi condivisi e programmatici dell’agenda Draghi come, per fare un esempio, i rigassificatori che sono decisivi per l’autonomia da Putin o termovalorizzatore a Roma, entrambi punti qualificanti del programma di Draghi degli ultimi mesi 4/4",2022-08-01 09:30:42+00:00,21,0
bendellavedova,"Per un accordo che sia efficace, anche solo sui collegi, ci vogliono però degli elementi minimi e uno di questi è il non mettere nei collegi uninominali personalità che non hanno mai votato la fiducia al governo Draghi o che diventerebbero ostiche per i rispettivi elettorali 3/4",2022-08-01 09:30:41+00:00,21,1
bendellavedova,"Questa è la discussione delle prossime ore e per questo ieri abbiamo fatto una proposta a Letta.
Bisogna evitare di fare favori a Meloni e Salvini che hanno come modello Orban, e che ci porterebbero agli estremi dell’euroscetticismo 2/4",2022-08-01 09:30:40+00:00,10,1
bendellavedova,"Da tempo @Piu_Europa, con @Azione_it sta lavorando a una alternativa europeista, liberaldemocratica e riformista che porti avanti l’agenda Draghi. 
Vedremo se avremo necessità di una corsa totalmente autonoma oppure se sarà possibile un accordo, solo sull’uninominale, con PD 1/4 https://t.co/FUp0uXKl68",2022-08-01 09:30:40+00:00,49,4
bendellavedova,"Anche per smentire alcune ipotesi stampa, pure di oggi: @Piu_Europa ha stretto patto federativo con @Azione_it a gennaio 2022. Prossimi giorni decideremo come andare a elezioni. Naturalmente ci presenteremo insieme, senza ombra di dubbio, sotto insegne federazione +Europa/Azione.",2022-07-30 07:54:39+00:00,674,54
bendellavedova,"Pura fantasia. 
https://t.co/DcP8ZF1Eib",2022-07-29 15:08:02+00:00,149,14
bendellavedova,"Dopo Salvini, è Berlusconi a ricordarci che la destra ha idee ben precise sulla collocazione italiana nel mondo: amici di Putin ed Orban e dei loro modelli dittatoriali ed illiberali.
@Piu_Europa sostiene la resistenza Ucraina che difende democrazia e aspirazioni europee di Kiev https://t.co/vrYek5mOZs",2022-07-29 09:30:35+00:00,342,57
bendellavedova,"#Salvini fa finta di non capire: la sua amicizia con #Putin è un fatto e rappresenta una scelta di campo.Non si può stare con la #Nato e con Putin. Come non si può stare con #Orban e con la #Ue. La campagna elettorale è il tempo della chiarezza, anche per Salvini.",2022-07-28 08:43:09+00:00,1030,201
