username,tweets,date,likes,retweets
marcocappato,"Democrazia non è solo elezioni, ma anche partecipazione popolare tra una elezione e l’altra. Appuntamento a Modena, il 13 ottobre https://t.co/1EyCnnOAKA https://t.co/n7xcGgerC1",2022-09-30 17:20:00+00:00,175,34
marcocappato,Chi manifesta a difesa del diritto all'#aborto di fronte al pericolo Meloni tenga anche presente che l'attuale (non il prossimo) Ministro della Salute R. Speranza rifiuta da mesi di fornire i dati aperti sull'obiezione di coscienza chiesti da @chiaralalli @ass_coscioni  #maidati,2022-09-28 11:45:39+00:00,5765,993
marcocappato,"Con l’affluenza più bassa nella storia, occuparsi degli strumenti digitali per rivitalizzare la democrazia è un modo per iniziare a rispondere al problema"" ⁦⁦@LorenzoMineo_⁩ @giornalettismo⁩
⁦@theeumans⁩

su: https://t.co/O3ovXxEDRu https://t.co/O3ovXxEDRu",2022-09-28 08:23:12+00:00,244,34
marcocappato,"@fiorgioba @ArmandoBarbato Lei è contrario al referendum, ma la Costituzione no.",2022-09-27 21:11:23+00:00,2,0
marcocappato,@fiorgioba @ArmandoBarbato Ricordiamo che in Italia il referendum non si può fare solo su tre materie,2022-09-27 19:29:17+00:00,1,0
marcocappato,"@GiovanniUngania Il referendum è solo abrogativo, non può esplicitare casistiche. Quello lo può fare solo il Parlamento, oppure la Corte costituzionale dopo che il referendum è stato approvato.",2022-09-27 18:30:20+00:00,2,0
marcocappato,"Ora che le elezioni sono passate diventa ancor più inutile agitare la paura dell’“uomo nero”, in questo caso donna. Serve invece ricostruire la partecipazione democratica.

Mio commento al voto, in vista del Congresso @ass_coscioni e assemblea @theeumans:
https://t.co/HmhTCIncIl",2022-09-27 15:58:25+00:00,142,30
marcocappato,"@Zuldazar71 infatti non sostengo che eutanasia e cannabis facciano vincere le elezioni, ma che Letta abbia mancato un'occasione di provare a sconfiggere Meloni prima delle elezioni.",2022-09-27 15:47:09+00:00,7,0
marcocappato,"@ognifrank Per chi sa che i programmi non contano quasi nulla e i fatti contano quasi tutto, sì, quello era il calcolo. Il miraggio del voto cattolico inganna però chi scambia il Vaticano per i cattolici.",2022-09-27 08:11:39+00:00,0,0
marcocappato,@GiovanniUngania Non c’era una maniera più corretta. Infatti nessuno ha mai saputo indicarla.,2022-09-27 07:30:25+00:00,12,0
marcocappato,@cincinnato6 Ti scuso,2022-09-27 07:29:27+00:00,22,0
marcocappato,@robyroma1 @RamingodiArnor Intendo batterla nei referendum. Il che avrebbe prodotto conseguenze anche per le elezioni successive,2022-09-27 05:51:17+00:00,58,0
marcocappato,"@Didier131193 I quesiti erano perfetti, la scelta della Consulta è stata di natura politica. In 8 mesi ancora non si è trovato qualcuno in grado di spiegare come avrebbero dovuto essere scritti meglio.",2022-09-27 05:50:04+00:00,4,0
marcocappato,"@Andrea31557280 Come temi di campagna elettorale non spostano molto. Come votazioni popolari referendarie segnano un’epoca ancora più che le elezioni, vedi divorzio.",2022-09-27 05:48:12+00:00,188,3
marcocappato,"Ovviamente mi permetto di dirlo dopo il voto solo perché l’ ho detto anche prima. 

Per la parte propositiva, ci vediamo al congresso @ass_coscioni e assemblea @theeumans dal 13 al 16 ottobre a Modena.

Più info: https://t.co/tXqSkaXb4G",2022-09-27 05:19:25+00:00,324,17
marcocappato,"Più che le alleanze, Letta ha sbagliato a osteggiare i referendum eutanasia e cannabis, abbandonandoli alla mannaia della Corte costituzionale. Col miraggio del voto cattolico, ha mancato l’occasione di battere Meloni su temi concreti di oggi invece che sui pericoli per il domani",2022-09-27 05:16:16+00:00,3203,231
marcocappato,"In memoria di Gianfranco Spadaccia: un’umanità ricca quanto spigolosa, un affetto a volte iracondo a volte benevolo verso le intemperanze mie e di tante altre persone alle quali ha comunque teso sempre la mano del dialogo e dell’aiuto.
https://t.co/Zuaw3pAKGQ @ass_coscioni",2022-09-26 16:50:24+00:00,100,10
marcocappato,@billevans69 Non era un elogio a Cuba,2022-09-24 16:01:11+00:00,3,0
marcocappato,@LucaPinotti_Mi Sé l’ hai scambiato per un apprezzamento per Cuba mi sono fatto capire male,2022-09-24 16:00:49+00:00,4,0
marcocappato,"Alle urne, per partecipare all'iniziativa di verbalizzazione collettiva per denunciare che queste elezioni si tengono in violazione dei diritti civili e politici dei cittadini, a partire dall'esclusione della Lista Referendum e Democrazia, ma non solo.  https://t.co/PGu7hf7ROF",2022-09-24 14:22:35+00:00,141,18
marcocappato,"Domani si vota anche per i diritti civili. 
A Cuba.

https://t.co/3qsQMC9gQ8",2022-09-24 10:14:37+00:00,410,47
marcocappato,"Fissata la data per il reclamo sull'esclusione dalle elezioni della @ListaReferendum e democrazia: IL 6 OTTOBRE.

Forse ci siamo dimenticati di specificare nell'atto della procedura ""d'urgenza"" che parlavamo di queste elezioni.",2022-09-23 14:12:18+00:00,805,118
marcocappato,"Sui diritti civili, lo scontro elettorale è tra chi non è stato capace di fare passi avanti e chi sarebbe capace di fare passi indietro.
Scegliere è meno difficile che crederci. Servirà dell'""altro"", da preparare a ottobre al Congresso @ass_coscioni:

https://t.co/YO1svuirEN",2022-09-23 13:58:21+00:00,156,20
marcocappato,"@Rhaegar94 No, ma vanno bene entrambi perché le iniziative sono convergenti",2022-09-22 16:32:06+00:00,2,0
marcocappato,"@lollertrap 1- sì
2- sì",2022-09-22 16:31:37+00:00,2,0
marcocappato,"Qualunque cosa votiate o non votiate, c’è una dichiarazione da consegnare ai seggi sulla violazione del diritto alla democrazia. Serve per i ricorsi, come quello vinto da M. Staderini all’Onu, o quello pendente a Strasburgo. https://t.co/ecPTMJ9ZKk",2022-09-22 11:08:00+00:00,199,60
marcocappato,@brusco_sandro @FrancescoPonzin https://t.co/khglKtS1ZT,2022-09-21 09:50:34+00:00,5,1
marcocappato,"@brusco_sandro @FrancescoPonzin Ti dico solo che con la firma digitale hai la certezza matematica che il documento firmato sia quello depositato, cioè che i nomi dei candidati non siano aggiunti dopo che la persona ha firmato.",2022-09-21 07:50:12+00:00,23,3
marcocappato,"@brusco_sandro per me i ""costi di entrata"" si possono anche alzare, Sandro (un anno fa raccogliemmo 2mln di firme). Il problema è quando i costi sono chiesti attraverso modalità discriminatorie contro intere categorie di cittadini (residenti all'estero e fuorisede, persone con disabilità).",2022-09-21 07:48:11+00:00,36,0
marcocappato,@Giulia_B Sopresa era ironico :-) Le motivazioni certo sono sorprendenti https://t.co/AVZA9uR0gx,2022-09-20 14:10:45+00:00,15,1
marcocappato,Qui spiegato nel dettaglio: https://t.co/AVZA9uR0gx,2022-09-20 14:09:02+00:00,58,16
marcocappato,Qui spiegato nel dettaglio: https://t.co/AVZA9uR0gx,2022-09-20 14:08:29+00:00,28,9
marcocappato,@GaetanoBresci9 @ListaReferendum https://t.co/AVZA9uQsqZ,2022-09-20 13:51:49+00:00,18,2
marcocappato,"Kafka e le elezioni italiane:

la prova richiesta dal Tribunale (cioè le firme) sarebbe stata per la @ListaReferendum IMPOSSIBILE, trattandosi di documentazione in possesso degli uffici elettorali, dunque non più in nostro possesso.

Qui è spiegato bene:
https://t.co/AVZA9uQsqZ",2022-09-20 13:43:20+00:00,205,46
marcocappato,"Le nostre firme giacciono presso la Corte d'Appello. Il Tribunale avrebbe dovuto esprimersi sulla validità della firma digitale: se valida, la Corte d'A. avrebbe poi dovuto contare le firme. Invece, per il Tribunale manca la prova che le firme  (che la Corte ha) ci siano davvero!",2022-09-20 12:28:11+00:00,766,122
marcocappato,"Le nostre firme giacciono presso la Corte d'Appello. Il Tribunale avrebbe dovuto esprimersi sulla validità della firma digitale: se valida, la Corte d'A. avrebbe poi dovuto contare le firme. Invece, per il Tribunale manca la prova che le firme  (che la Corte ha) ci siano davvero!",2022-09-20 12:27:39+00:00,366,36
marcocappato,https://t.co/gxJmFURNH2,2022-09-20 11:44:54+00:00,165,23
marcocappato,"Sorpresa: rigettato il ricorso, @ListaReferendum non è ammessa al voto. Il giudice ci imputa di non aver dimostrato l’esistenza delle firme che lo Stato si è rifiutato di verificare. Il ricatto sul rinvio voto ha funzionato. Ricorreremo in ogni sede. E otterremo la firma digitale",2022-09-20 11:44:54+00:00,1983,239
marcocappato,"In attesa dell’ esito del nostro ricorso sulla firma digitale, ecco “Libertà di voto”: la piattaforma per sapere chi si vota nell’uninominale. E come si può fare ricorso gratis contro il Rosatellum 
@mariostaderini @ListaReferendum 

https://t.co/yoiDOsEzKm via @fattoquotidiano",2022-09-20 05:58:38+00:00,151,31
marcocappato,"Ancora nessuna decisione sulla riammissione della @ListaReferendum. Intanto mancano 6 giorni al voto.

++++Elezioni: discusso ricorso Cappato, decisione prima del voto 
Su caso delle firme digitali si esprimerà Tribunale Milano 
MILANO  (ANSA) - MILANO, 19 SET+++",2022-09-19 16:54:31+00:00,537,76
marcocappato,@gms1968 @ListaReferendum Sì,2022-09-19 16:50:31+00:00,1,0
marcocappato,@stefanoorsini3 @ListaReferendum Sì,2022-09-19 16:50:24+00:00,0,0
marcocappato,Si è tenuta l’udienza contro l’esclusione della “@ListaReferendum e Democrazia con Cappato” dalle elezioni e per il riconoscimento della firma digitale. Siamo in attesa della sentenza.,2022-09-19 11:04:16+00:00,1103,107
marcocappato,"Le elezioni potrebbero saltare al 25 novembre, attesa decisione su ricorso Cappato https://t.co/oLKqB2SMm0 via @moneypuntoit",2022-09-18 22:11:33+00:00,356,79
marcocappato,"Ecco perché il Governo agita in tribunale il rischio del rinvio delle elezioni, difende l’esclusione della nostra @ListaReferendum e contesta la validità della firma digitale:

Conferenza stampa Lista Referendum e Democrazia con Cappato https://t.co/sz4FvpwlAb via @YouTube",2022-09-17 09:52:21+00:00,153,35
marcocappato,"@camiziani @LucaBizzarri no, non hanno accettato le firme da nessuna parte",2022-09-16 16:09:11+00:00,4,0
marcocappato,@PaganiStella @LucaBizzarri Una vacanza digitale!,2022-09-16 16:08:47+00:00,20,0
marcocappato,"Per un'intelligenza artificiale fondata sull'umano.

Ne parliamo mercoledì 21, di persona in Olanda, a l'Aja, e online.

#IA #AI #IntelligenzaArtificiale #ArtificialIntelligence @ScFrDy @theeumans @ass_coscioni 

https://t.co/UuPvmamjBL",2022-09-16 16:08:03+00:00,53,10
marcocappato,@LucaBizzarri Prima mi chiedi di allungare i tempi del tuo podcast e poi mi scarichi così? Dai scherzo. Se ci riammettono magari rinunciamo a partecipare in cambio di un decreto urgente che riconosca la validità della firma digitale d'ora in poi. Se ce lo propongono. Se hanno un amico.,2022-09-16 15:24:39+00:00,693,12
marcocappato,Aggiornamento: telefonata di scuse e 20 euro di buono per la spesa. Bravi.,2022-09-16 14:38:46+00:00,79,1
marcocappato,Conferenza stampa oggi online sulla mia pagina Facebook e YouTube alle ore 15:30,2022-09-16 11:14:30+00:00,127,21
marcocappato,Il Governo #Draghi si è costituito in giudizio contro l'ammissione della nostra Lista alle elezioni. Dicono che altrimenti si dovrebbero spostare le elezioni. Ma questa è esattamente la conseguenza dell'inerzia del Governo che non risponde da 2 mesi!!,2022-09-16 11:14:30+00:00,776,110
marcocappato,"Esperienza di oggi con #Esselunga a domicilio: nemmeno metà dei prodotti ordinati sono stati consegnati. ""Problemi di magazzino"", dunque niente alimentari. In chat reclamo chiedono a me di elencare i prodotti che loro non hanno consegnato. 
@TuttoEsselunga da ripensare.",2022-09-16 09:45:12+00:00,141,11
marcocappato,"Oggi è giornata mondiale della democrazia. Oggi il Governo #Draghi potrebbe emendare il decreto e chiarire la validità della firma digitale. Altrimenti, il 19 settembre ci sarà udienza del tribunale di Milano sull'esclusione della Lista referendum e democrazia. @ListaReferendum",2022-09-15 08:56:37+00:00,287,44
marcocappato,Oggi è la #giornataInternazionaleDellaDemocrazia. Lunedì il tribunale deciderà sul nostro ricorso per la validità della firma digitale. Oggi alle 13 sarò davanti alla Prefettura di Milano per chiedere al Governo di non sprecare anche questa occasione per la democrazia digitale.,2022-09-15 07:59:08+00:00,592,92
marcocappato,"9 anni fa depositammo la legge d'iniziativa popolare per l'eutanasia legale. Il Parlamento da allora non ha mai trovato il tempo di discuterla, lasciandola ""decadere"". Gli stessi che deprecano l'astensionismo. 
Noi andiamo avanti nelle altre aule, quelle di giustizia. https://t.co/wokJipCPYI",2022-09-13 16:04:00+00:00,1181,225
marcocappato,"@laramps Antonella, ""Amato ha spiegato"" non è una risposta. Amato ha fatto l'esempio che ho riportato. Quell'esempio era falso, e ho spiegato perché. Infatti, né lui né alcun giurista ha poi difeso quell'esempio. Non è una polemica la mia né un insulto, ma una denuncia politica.",2022-09-13 13:53:26+00:00,2,0
marcocappato,"@laramps Amato disse che, come risultato del nostro referendum, una persona che aveva ""un po' bevuto"" avrebbe potuto farsi uccidere. Era una menzogna, perché il referendum non abrogava i commi della legge relativi alla volontà. Lo dissi e lo confermo. Se credi il contrario, spiega perché.",2022-09-13 13:44:43+00:00,2,0
marcocappato,"@ichbinderteufel E' la stessa Consulta a dire che non si può anticipare il giudizio di Costituzionalità della normativa di risulta, ma poi tradisce tale asserzione attraverso il concetto di divieto di abrogazione di leggi costituzionalmente necessarie, criterio inesistente in Costituzione.",2022-09-13 13:36:55+00:00,8,0
marcocappato,"@pumpitall_italy i referendum erano perfetti. Infatti nessuno dei tanti che hanno detto che erano scritti male ha saputo spiegare come meglio avrebbero potuto essere scritti. Se però vuole provare a essere il primo, prego: la ascoltiamo.",2022-09-13 13:27:24+00:00,3,0
marcocappato,"@Vittori16400092 Non ti devi scusare. Solo che la Costituzione dice tassativamente quali siano le materie sulle quali non si possono tenere referendum, a gettone o senza gettone ch siano.",2022-09-13 13:26:25+00:00,0,0
marcocappato,"@quidmetuis2975 lunedì 19 settembre ci sarà l'udienza del nostro ricorso per essere riammessi alle elezioni. Se perdiamo, non ci potrai votare.",2022-09-13 13:25:16+00:00,1,0
marcocappato,"@f_nicosia @petergomezblog i referendum erano perfetti. Infatti nessuno dei tanti che hanno detto che erano scritti male ha saputo spiegare come meglio avrebbero potuto essere scritti. Se però vuole provare a essere il primo, prego: la ascoltiamo.",2022-09-13 13:24:24+00:00,0,0
marcocappato,@paolo_tode si trattava di vita e di libertà. E molti giovani lo avevano capito.,2022-09-13 13:22:04+00:00,15,1
marcocappato,"@ichbinderteufel La Costituzione non impedisce referendum a esito ""ambiguo"", ma impedisce referendum su tre materie tassativamente indicate. Un giudizio di costituzionalità anticipata del testo a valle è contrario alla Costituzione, persino secondo la Corte costituzionale. Il testo era perfetto.",2022-09-13 13:19:50+00:00,23,1
marcocappato,"@laramps ho pubblicamente e dettagliamente spiegato (riferendomi ad alcuni tra i massimi costituzionalisti) perché quel referendum fosse perfettamente ammissibile e il giudizio sia stato di natura politica. Il Presidente Amato ha anche aggiunto alcune falsità, da noi documentate.",2022-09-13 13:08:39+00:00,5,1
marcocappato,"@laramps Non era ""istigazione"" al suicidio, ma ""aiuto"". Per l'accusa di ""istigazione"" fui assolto direttamente dal tribunale di Milano. La Consulta (presieduta da Cartabia) riconobbe l'incostituzionalità parziale dell'aiuto. Col referendum avrebbe potuto fare lo stesso, ma dopo il voto.",2022-09-13 10:58:53+00:00,4,1
marcocappato,"@Animamigrante Così dicono alcuni sondaggi, ma non siamo sicuri.",2022-09-13 10:43:52+00:00,0,0
marcocappato,"@Berardo90206887 @petergomezblog ""una delle persone"".",2022-09-13 09:13:47+00:00,25,0
marcocappato,"Oggi Giuliano Amato lascia la Corte costituzionale. Spero che i prossimi Presidenti e giudici sapranno far rientrare nell'alveo della Costituzione i giudizi in materia di referendum. Se la ""generazione Z"" ha poca voglia di votare, una delle persone da ""ringraziare"" è Amato.",2022-09-13 08:55:36+00:00,3255,424
marcocappato,@dariopt1999 In democrazia la forma è sostanza. Senza capire questo non si va lontano,2022-09-11 19:29:08+00:00,0,0
marcocappato,"@dariopt1999 Fatti almeno venire il dubbio sul fatto che il Paese vada a rotoli anche perché la democrazia non funziona, e che se dunque non ci si sa occupare di quello il resto conti poco.",2022-09-11 12:13:34+00:00,0,0
marcocappato,"@serwinem @Manuel16381191 @puscascapo @LaBombetta76 @ParcodiGiacomo Questo è falso, visto che sarebbe rimasta intatta la parte della norma sulle condizioni psichiche.",2022-09-11 12:11:07+00:00,0,0
marcocappato,@TwentyOneEight2 Preoccuparsi senza occuparsi è sempre in vano,2022-09-09 19:48:04+00:00,0,0
marcocappato,Il 19 settembre davanti al tribunale finalmente il Governo dovrà prendere posizione sulla validità della firma digitale. Spero che Draghi e Lamorgese evitino di esporre l'Italia a condanne internazionali. #ElezioniPolitiche2022  https://t.co/MY1ZB2eQNK,2022-09-09 16:01:30+00:00,207,41
marcocappato,Pericoli per la democrazia? E' più utile occuparsene in concreto che preoccuparsi in vano. Il Governo mantenga l'impegno di una piattaforma pubblica per la firma online sui referendum! https://t.co/oEXGGlsDvk,2022-09-09 06:13:00+00:00,197,37
marcocappato,"Sul testamento biologico il Governo non fornisce i dati. Ancora una volta, ci pensiamo noi dell' @ass_coscioni, perché non c'è libertà senza conoscenza. https://t.co/KoLi7mQi23",2022-09-08 15:10:52+00:00,181,23
marcocappato,"@F1Sofa questo è chiaro, ma non credo che la conseguenza possa essere che la tecnologia non deve essere usata mai per la democrazia, mentre la usiamo per ogni altra attività umana, anche attività dalle quali dipende la nostra vita. Non si può mettere tutto nel mucchio",2022-09-04 19:47:20+00:00,1,0
marcocappato,"@animadellafesta @etherea_etherea @Prudenzi4 @Corriere Dunque per sostenere il diritto a divorziare bisogna prima dare l'esempio divorziando? Va bene non leggere, ma un piccolo sforzo per capire si può fare lo stesso.",2022-09-04 19:23:12+00:00,0,0
marcocappato,@etherea_etherea @animadellafesta @Prudenzi4 @Corriere Le eutanasie clandestine sono praticate per chi se lo può permettere e senza alcun controllo. Se a Lei va bene così capisco. A me no. Tutto il resto è in effetti propaganda.,2022-09-04 19:21:25+00:00,1,0
marcocappato,"@F1Sofa Il problema del quale stiamo parlando è il voto (cartaceo)  dei fuorisede (circa 6 milioni di persone che non voteranno), ed in particolare come evitare che una persona si presenti ai seggi due volte.",2022-09-04 19:18:37+00:00,0,0
marcocappato,"@F1Sofa non è voto elettronico, è spunta digitale di chi ha votato, che quindi non potrà votare due volte (sempre con cartaceo).",2022-09-04 17:33:40+00:00,1,0
marcocappato,"@F1Sofa Nella proposta citata non si parla né di voto elettronico né di blockchain, ma di modalità per evitare che una persona fuorisede voti due o più volte, in modalità rigorosamente cartacea. L'unica cosa ""elettronica"" sarebbe la spunta nell'elenco dei votanti. A me pare diverso.",2022-09-04 17:29:09+00:00,1,1
marcocappato,"@F1Sofa non è ""voto elettronico"". Magari prima prova a leggere.",2022-09-04 17:04:20+00:00,1,0
marcocappato,"@Emanuele676 E ""veramente"" non era possibile farla prima? E ""veramente"" era imprevedibile la fine anticipata della legislatura. Oppure, veramente, il green pass è stato messo in piedi in un battibaleno e quando c'è la volontà si trova una soluzione.",2022-09-04 16:53:48+00:00,5,0
marcocappato,le soluzioni per fare votare i fuori sede ci sono. Ma non si è voluto attuarle. https://t.co/XYgTuxGdbW,2022-09-04 16:40:24+00:00,289,51
marcocappato,"@animadellafesta @etherea_etherea @Prudenzi4 @Corriere è quello che ho detto nell'intervista (a parte l'attesa del Giudizio, che poco mi interessa). Stai facendo una polemica senza leggere o senza capire. Perché se non capisci la differenza tra decidere di fare qualcosa e difendere il diritto di altri di farlo è inutile discutere.",2022-09-04 16:38:34+00:00,0,0
marcocappato,"@animadellafesta @etherea_etherea @Prudenzi4 @Corriere in buona sostanza o non hai capacità di lettura di un testo scritto oppure fai finta di non capire. Per decidere se chiedere o no l'eutanasia bisogna trovarsi in una situazione estrema, come quella delle persone che ho aiutato. Scegliere ""a prescindere"" non è possibile.",2022-09-04 16:02:57+00:00,0,0
marcocappato,"@PMolena @Corriere Grazie per la precisazione, sono andato a memoria. Sicuramente alle europee '89 votai Lista antiproibizionista (Taradash) e sicuramente in quel periodo -o forse nella stessa tornata elettorale- votai alle comunali il partito del Segretario Occhetto che era in dialogo con Pannella",2022-09-04 16:00:11+00:00,0,0
marcocappato,"@etherea_etherea @Prudenzi4 @animadellafesta @Corriere No, è un ragionamento, ma capisco che per Lei sia difficile riconoscerlo.",2022-09-03 12:54:12+00:00,1,0
marcocappato,@Entreri_Arnodas @Corvonero75 Se si vuole pagare una bella somma per una causa per diffamazione sì!,2022-09-03 12:51:16+00:00,1,0
marcocappato,@GioCascio @petergomezblog @vitt61 @theeumans Grazie a te,2022-08-31 15:44:40+00:00,1,0
marcocappato,"@GioCascio @petergomezblog @vitt61 @theeumans In questo caso l'""agenda"" (o non ""agenda"") è il risultato dei fatti, non delle promesse o dei programmi.",2022-08-31 08:53:14+00:00,5,0
marcocappato,"@marcoriga58 Non c'è bisogno di un voto del Parlamento per la piattaforma. La firma digitale sui referendum è già legge, dunque la piattaforma è un provvedimento attuativo che il Governo può realizzare senza alcun problema.",2022-08-31 06:43:44+00:00,1,0
marcocappato,"Qualcuno può controllare se tra i 233 provvedimenti attuativi entro ottobre, sollecitati da Draghi ai Ministeri, c’è anche la piattaforma pubblica per la sottoscrizione dei referendum, promessa dal Ministro Colao @vitt61 ? Entrerà la democrazia  nell’”agenda Draghi“? 

@theeumans",2022-08-31 05:59:31+00:00,536,80
marcocappato,"@lastknight Grazie per la conversazione, Matteo!",2022-08-30 20:10:15+00:00,24,0
marcocappato,"@semanthide3 il mio era un invito serio, perché dalla Sua domanda deduco che Lei non sia al corrente di come solitamente sono raccolte le firme. Grazie comunque per il sostegno e l'appoggio.",2022-08-29 21:31:43+00:00,0,0
marcocappato,"@Bovaz @Grasiento Sto parlando di firma digitale, non di voto telematico",2022-08-29 11:22:08+00:00,6,0
marcocappato,@pulcetto Non sapere distinguere tra democrazia e populismo è ciò che ha spianato la strada al populismo stesso. E si persevera.,2022-08-29 09:28:54+00:00,1,0
marcocappato,"@pulcetto Se anche solo una/o tra Meloni, Letta, Salvini, Conte, Berlusconi, Calenda avesse fatto una lotta su anche solo una delle questioni che ho elencato le cose sarebbero andate diversamente. Ecco perché il calderone è unico, con differenze poco rilevanti.",2022-08-29 09:26:02+00:00,18,0
marcocappato,"@pulcetto Grazie per l’assenza di qualsiasi argomentazione, come tua abitudine",2022-08-29 09:13:16+00:00,7,0
marcocappato,"@SurrexitVere @marioadinolfi soprattutto disabili gravi, residenti all'estero, persone in vacanza (a ferragosto, una rarità) e fuorisede. Fatti pure 'na risata che il riso abbonda...",2022-08-29 07:40:51+00:00,2,0
marcocappato,"@semanthide3 provi a chiedere (in privato) a chi ha raccolto ""normalmente"" e poi capirà, credo.",2022-08-29 07:39:09+00:00,6,1
marcocappato,"@pulcetto i vertici dei principali partiti, con eccezioni sempre così ridotte e marginali da renderle inefficaci. Non sono dunque soggetti diversi. Non hanno bisogno di un accordo: è un istinto, antidemocratico. Sono una casta? A me pare di sì, ma mi importa più l'azione che la definizione",2022-08-29 07:37:44+00:00,114,4
marcocappato,"Aggiungiamo in effetti: voto impedito ai fuorisede, legge elettorale immodificata che impedisce di scegliere i candidati del partito  e della coalizione, par condicio sistematicamente violata con monopolio dei salotti (""talk show"") dei soliti noti.",2022-08-29 07:26:54+00:00,1000,114
marcocappato,Se invece di preoccuparsi ce ne si volesse occupare: https://t.co/R2vyyt6QCE,2022-08-29 07:19:48+00:00,282,42
marcocappato,"Preoccuparsi per l'astensionismo. Dopo avere boicottato i referendum cannabis e eutanasia, ignorato per anni le leggi di iniziativa popolare, affossato la piattaforma pubblica di partecipazione, impedito la presentazione di liste con firma digitale.
Ci vuole un bel coraggio.",2022-08-29 07:18:44+00:00,4361,683
marcocappato,@Monia_Podda https://t.co/R2vyyt6QCE grazie,2022-08-27 20:21:34+00:00,5,1
marcocappato,Aspettando il Vinitaly: https://t.co/DWFDbAq3Sr,2022-08-27 20:12:38+00:00,2458,204
marcocappato,"@Enchiridii che non importi a Lei l'avevo capito. Non ho messo in discussione che la legge dica quello che dice, ma che sia ragionevole e non discriminatorio ciò che dice, anche in riferimento a principi costituzionali e normativa internazionale.",2022-08-27 20:11:02+00:00,1,0
marcocappato,"""Le firme digitali valgono ovunque nella Pubblica amministrazione, si usano per firmare contratti. Cinquecentomila firme digitali per i referendum ok, cinquantamila per le elezioni no. Ci sarà una ragione, ma non la capisco."" @concitadeg 

https://t.co/ifRTnQy4dk",2022-08-27 20:02:56+00:00,483,82
marcocappato,"@Enchiridii La presentazione delle liste non è ""qualsiasi altra cosa"": è esattamente la stessa identica procedura in materia elettorale.",2022-08-27 19:54:25+00:00,0,0
